{"contrib_q_u16":{"pca":{"bed1":"vAC8ALwAuwC7ALoAuQC4ALcAtgC0ALMAsQCvAK4ArACqAKgApgCkAKIAoQCfAJ0AmwCZAJcAlgCUAJIAkQCPAI0AjACKAIgAhwCFAIMAewB6AHgAdwB2AHUAcwByAHEAcABvAG4AbQBrAGoAaQBnAGYAZABjAGEAXwBdAFsAWQBXAFUAUwBRAE8ATQBKAEgARQBDAEEAPgA8ADkANwA0ADIALwAtACsAKQAnACUAIwAhAB8AHQAbABoAGAAWABUAEwASABEAEAAOAA0ADAALAAoACQAIAAgABwAGAAUABQAEAAQAAwADAAIAAgACAAEAAQABAAEAAQABAAEAAQABAAEAAgACAAIAAwADAAQABAAFAAYABwAGAAcACAAJAAsADAANAA8AEAASABQAFgAYABoAHAAfACEAJAAmACkAKwAuADEANAA3ADoAPABAAEMARgBOAFEAVABXAFoAXQBgAGMAZQBoAGsAbgBxAHQAdgB5AHwAfwCCAIUAiACLAI8AkgCWAJkAnQD6CNIn/SJEHrkZcBV8EfYN8gqCCK8GAAVwBGUEyQSGBYMGrwf3CE4KqwsFDVcOnQ/UEPsREBMUFKcdrRlyE2MOPgpEB5gFNQXyBZAHyAmwC2UOJRHaE3YW8BghGyEd+h6sIDsipiPzJCImRjKFAlABZQI6BekSpBWjGLcbwB6qIWok/CbLM0AKXAgOCd8LChC9FGMZAx7vIuYmeSrDLbMwQjORNaY3XzwOPpk/AEFJQnRDdURcRT9GA0ezRxxIbEi+SA9JR0lvSZpJuUnOSedJ6UnhSdJJvEmfSXtJUkkjSfBIt0hfSLtHXEexRk1G60WHRSJFvkRZRPVDkEMsQ2ZCn0HWQA1AQT91Pqg92jwLPDo7aTqXOcQ48TcdN0g2cjWcNMYz7jIXMj8xZjCNL7Uu3C0CLSksTyt2KpwpwijpJw8nNiZeJYQkrSPWIv8hKSFUIIAfrB7ZHQcdNxxoG5sazxkEGTsYdRexFu4VLhVwFLUT/BJGEpMR4hAzEIgP4Q47DpoN/QxjDMwLOQuqCh8KlwkTCZMIAgiKBxcHqQY+BtcFdQUWBbsEZQQSBMIDdwMwA+wCqwJtAjMC/AHIAZgBagFAARkB9QDTALQAmQCAAGkAVQBDADQAJwAcABMADQAIAAUABQAGAAgADQATABoAIgAtADgARABSAFsAagB6AIsAnQCwAMQA2ADtAAMBGQEwAUYBXQF0AYwBUQLXOec1ATIsLmsqxCY9I90fqRynGd4WUxQLEggQSg7QDJgLnAraCUkJ5QimCIYIfwiNCKsI1AgECToJmgLUAhQDVgOaA90DHwRfBJwE1gQPBUQFdQWiBcsF8QUSBjAGSwZjBngGigabBqkGtQbABskG0QbYBuAG5gaYBkoG/gW0BWsFJAXeBJoEWAQYBNoDnQNjAyoD9AK/Ao0CXQIvAgMC2AGvAYkBXAE6ARsB/gDiAMkAsQCbAIcAdABkAFUARwA7ADAAJwAfABkAFAAQAA0ADAAMAA0ADwASABYAGwAgACcALwBXAGQAcQCAAJAAnwCwAMEA1ADdAPEABAEZAS4BRAFaAXEBiAGgAbkB0QHpAQICFwItAkMCWQJuAoMCmQKtAsAC0wLmAvkCCwMcAy0DPgNPA18DbgN9A4wDmgOoA7YDwwPPA9wD6AP0AwAECgQVBCAEKgQ1BD4ESQRSBFsEZARsBHUEfQSFBI0ElQSdBKQEqwSvBLMEtwS7BL4EwgTFBMcEygTNBM8E0ATSBNME1ATVBNYE1gTWBNYE1QTVBNQE0wTRBNAEzwTNBMsEyQTGBMQEwQS/BLwEugS2BMUEwQS9BLcEsgSsBKYEnwSYBJEEigSDBHsEdARrBGMEWwRSBEsEQgQ6BDIEKQQhBBoEEgQLBAME/AP4A/ED6QPgA9cDzgPEA7kDrwOkA5kDfQNyA2gDXQNXA1EDSwNGA0ADOgM0Ay4DKAMhAxwDFgMPAwkDAgP7AvQC7QLlAt0C1QLNAsUCvAK0AqwCowKaApAChwJ9AnQCagJgAlYCTQJDAjoCMAImAh0CEwIJAgAC9gHtAfAB5gGLAYIBeQFwAWYBXQFUAUwBQgE6ATIBKQEhARkBEAEIAQEB+QDyAOsA5ADdANYA0ADKAMYAwgC+ALoAtgCyAK8ArACpAKYAogCfAJwAkgCPAIwAiQCGAIIAfwB7AHgAdQBxAG4AawBoAGUAYgBgAFsAWABWAFQAUgBQAE8ATQBMAEsASABEAEEAPgA6ADcANAAxAC4AKwAoACUAIgAgAB0AGwAYABYAFAASABAADgANAA0ADAAKAAkABwAGAAUABAADAAIAAgABAAEAAQABAAEAAQABAAEAAQADAAMABAAFAAYABwAIAAkACgALAAoADAANAA4AEAARABIAFAAWABgAGgAcAB4AIAAiACQAJwAqAC0ALwA3ADoAPQBAAEMARgBKAE0AUQBUAFkAXgBkAGoAcAB2AHsAgQCHAI0AlACaAKAApQCrALAAtgC8AMIAyADOANQA2wDhAOgA7wD2APwAAwEKARIBGQEhASkBMAE4AUABSAFRAVkBYQFpAXEBeQGAAYcBjgGWAZ0BpAGsAbIBuQHAAcgBzwHWAd0B5AHrAfIB+QH/AQcCDQIVAhsCIgIoAi8CNgI9AkQCSwJSAlkCYAJnAm4CGAIeAiUCKwIxAjgCPgJFAksCUgJYAlICWQJgAmgCbwJ3An8ChwKQApgCoQKqArMCvALGAtAC2QLjAuwC9gIBAwwDFgMvDkAjIh4qGXAUDxAkDM8IJwY7BEkBni+sKfUjqx4KGk8WrBM4EuoRmhIOFAoWWRjPGk8dxB8qImkkhCZ/HLUewCCgIlkk8yVpJ78o9ykRKzMy5TKHMxo0njQVNX813TUwNng2tzbtNho3PzddN3M3gzeNN5E3kDeLN2c3QDcYN+w2vzaQNl82LTb5NcQ1RTXENEI0vjM7M7UyLzKoMSAxlzANMIMv+C5uLuMtVi3KLD0ssCsiK5UqLzXnEIQOEA1/DLcMkA3gDoAQUBI4FCAW/xfMGYEbGh2ZHvsfQSFrInsjcyRSJRsmzyZvJ/4neijnKEQpdS28LfgtKS5PLlYubi6BLo0ukS6RLooufi5sLlUuOy4dLvot1S2tLYItVC0kLfIsvSyHLFAsGSzfK6UraSvUKj0qpSkNKXMo2idAJ6YmCyZwJdUkOSSeIwMjgCLkIUghrCAQIHUf2x5AHqYdDR1fHMobOBumGhYaiBn7GG8Y5RdcF9UWUBbNFUwVzBRPFNMTWBPgEmkSDRKYESQRsRBCENIPZQ/4Do0OIg67DVUN8AyMDCoMywtsCxALtQpcCgQKrglbCQoJughtCCAI1weQB0kHBAfBBoAGQQYEBsoFjwVXBSEF7AS4BIcEVwQpBPwD0QOnA38DVwMxAw0D6QLGAqYChgJnAkoCLgISAvcBAAw=","bed2":"fgB+AH8AfwB/AIAAgACAAIAAgACAAIAAgAB/AH8AfwB/AH8AfwB/AH8AfwB/AH8AfwB/AH8AfwB/AH8AfwB/AH8AgACAAIAAgACAAIAAeQB5AHkAeQB6AHoAegB6AHoAegB7AHsAewB7AHsAewB7AHsAewB7AHsAewB7AHsAewB7AHsAewB7AHsAewB7AHwAfAB8AHwAfAB9AH0AfQB+AH4AfwB/AIAAgQCBAIIAgwCEAIQAhQCGAIcAiACJAIoAiwCMAI0AjgCPAJAAkQCSAJMAlACWAJcAmACZAJoAmwCcAJ4AnwChAKIAowClAKYAqACpAKsArACuALAAsQCzALUAtwC5ALsAvQC/AMEAxADGAMkAywDUANYA2QDcAN8A4wDmAOoA7gDyAPUA+QD+AAIBBgELAQ8BEwEYARwBIQElASkBLgEyATYBOgE+AUMBRwFGAUoBTQFRAVQBVwFaAVwBXgFgAWMBZQFnAWkBawFtAW8BcgF0AXYBeQF7AX4BgQGEAYcBiwFMCkMqiyXlIF8cBhjvEysQywzgCXkHOgUABE0DFANCA8UDiQR8BZEGuQfsCCEKUwt8DJsNrg6yD44bFx5mDwIK/gXHA4oDGgUNCOMLMhAiFJ8YCB1NIWglWSlMK8ksKy5yL6EwtzG3MqEzuj6ZDvkRhBQDGgUcgyG+JGon/SlsLLUu1DCwO4wMxQwiD2cWER4fJD8pki5jM+M3hDtWP2RCOkToRXBHbUenSMRJyEqzS4ZMdUweTJpMaEzzS1xMJEyZS8dLYUvFSu9KEEsnSzhLP0s9SzVLJUsQS/RK0kqrSoBKT0qHSOZGN0WxQxpCjUALP5M9JDy/OmM5EDjENqk1ljSMM4oyjjGaMKsvwi7fLQAtJixQK38qsSnmKB4oWSeWJtYlGCVcJKMj6yI1IoEhziAcIG0fvh4SHmUduxwSHGobxBofGnsZ2Rg4GJgX+xZeFsMVKhWTFP0TaBPWEkYSuBErEaEQGRCUDxEPkA4RDpUNGw2kDDAMwAtRC+YKfQoWCrEJUAnxCJQIOgjjB44HPAfsBp8GPgb2BbEFbgUuBfEEtQR8BEYEEQTfA68DggNWAywDBQPgAr0CnAJ9Al8CRAIqAhEC+wHmAdIBwAGvAaEBkwGHAXwBcgFqAWMBXgFZAVYBUwFRAVEBUQFSAVQBVwFaAV8BYwFoAXMBeQGAAYgBkAGZAaIBrAG2AcEBywHWAeEB7AH3AQMCZwF9Pb85CTZhMscuQivVJ4QkVSFPHnQbxxhMFgYU9xEgEH8OFA3eC9gK/wlPCcMIVggFCMwHpgePB4UHVAW8BSYGjgb1BlkHuQcUCGsIvQgICU0JjgnJCQAKMQpeCoYKqgrMCuoKBQseCzILQwtSC14LaAtxC3kLfgtrCmwJgAioB+EGKQaDBeoEYATiA28DCAOsAlgCDQLKAY4BWQEpAQAB2wC7AJ8AhABvAF0ATgBBADYALQAmACEAHQAaABgAFwAYABkAGwAdACEAJAApAC0AMwA4AD8ARQBMAFMAWwBjAGsAcwClALEAvQDJANYA4wDwAP4ACwEYAScBNQFEAVQBYwF0AYQBlAGlAbYBxwHXAegB9QEDAhACHQIqAjYCQwJOAlkCZAJuAngCggKLApMCmwKkAqwCswK6AsECxwLNAtMC2ALdAuIC5wLsAvAC9AL4Av0CAAMEAwgDDAMPAxMDFgMZAxwDIAMjAyYDKQMsAy8DMQMyAzIDMgMzAzMDMwMzAzMDMwM0AzMDMwMyAzEDMAMvAy8DLQMsAyoDKQMnAyYDIwMhAx8DHQMbAxgDFgMTAxEDDgMMAwkDBwMEAwsDCAMFAwAD+wL2AvEC7ALnAuEC3ALWAtACywLEAr4CuAKyAq0CpwKhApsClgKRAosChgKBAn0CeAJ1AnACawJmAmACWwJVAk8CSAJCAjwCKgIkAh4CGAIVAhICDwIMAgkCBgIDAgAC/QH6AfcB9AHwAe0B6gHmAeIB3gHaAdYB0gHNAckBxAHAAbsBtgGxAawBpwGiAZ0BmAGTAY4BiQGEAX8BegF1AXABawFmAWIBXQFYAV8BWwEtASkBJQEiAR4BGwEXARQBEQENAQoBBwEEAQIB/wD8APoA+AD1APMA8QDvAO0A6wDpAOcA5gDkAOIA4QDfAN4A3ADbANkA2ADXANUAygDJAMcAxgDFAMQAwgDBAMAAvwC+AL0AuwC6ALkAuAC3ALYAtQCzALIAsQCwAK4ArQCrAKkAqQCoAKcApwCmAKYApgCmAKYApgCmAKYApgCmAKcApwCoAKkAqgCrAKwArACtALYAtwC5ALsAvAC+AMAAwgDEAMYAyADKAMwAzwDRANQA1wDZANwA3gDaANwA3gDhAOMA5QDnAOgA6gDsAPQA9gD4APoA/AD+AAABAwEFAQcBCgENARABEgEWARkBHAEgASQBKAEnASoBLgEyATYBOQE9AUEBRAFIAU4BVgFeAWYBbQF0AXwBgwGKAZEBmQGgAaYBrAGyAbgBvgHEAcoB0AHXAd0B5AHrAfIB+QEAAgcCDgIVAhwCJAIsAjQCOwJEAksCUwJcAmQCbAJ1An0CgwKKApAClgKdAqMCqgKwArUCuwLBAscCzQLTAtgC3gLjAukC7gLzAvkC/gIEAwkDDgMSAxgDHAMiAycDLAMwAzUDOwNAA0UD7wLzAvgC/QICAwcDDAMRAxYDGwMgAycDLQMzAzkDPwNGA00DVANcA2MDawNzA3wDhAONA5YDnwOoA7ADuQPCA8sD1AOqDvglCiE5HJcXOxM5D6sLqAg+Bo0BcDWSL8MpIiTVHg0a+xXRErAQng+ID0gQqhF9E5MVzBcrGmQciB7kL3cx7jJKNIw1sDa9N7Q4lzllOhA5tzlQOt06XjvTOz48nzz1PEI9iD3FPfs9KT5RPnM+jj6kPrU+wT7JPhY9cTvbOVM42DZrNQs0uDJwMTQwGy8NLgotESwkKz0qYCmLKL4n9iY2JnwlxyQZJG8jyCImIogh7iBXIMMf0yqLC0UIBAbSBJ0EPQWCBjgINQpWDH8OoRCwEqUUexYyGMcZPRuUHMwd6R7qH9IgoyFeIgQjlyMXJIckDyZbJpsmzib1JgUnGycsJzMnMScpJxonAyfmJsImmSZrJjcmACbDJYMlPyX2JKskWyQJJLUjXyMGI6oiTCJ3Iakg4R8hH2UesB0BHVYcrxsNG28a1Bk9GakYKBiaFw4XhRb+FXoV+BR3FPkTfRP0En8SDBKcES4RwhBYEPAPig8mD8MOYw4GDqkNTw33DKAMSwz3C6cLbAsdC9AKggo4Cu0JpAldCRUJzwiKCEcIBAjDB4IHQwcGB8kGjgZUBhoG4wWtBXgFRQUTBeIEsgSEBFcELAQDBNoDswONA2kDRgMjAwID4gLCAqQChwJrAlACNgIdAgUC7QHXAcEBqwGXAYMBcQFfAU0BPQEsAR0B6Ag=","bfo1":"TQYeBmQGpAa8BkoGMQZZBk8G8wUSBtkF5wW/BakFegXSBbgFbgWaBagFZwWhBU0FkAWMBXEFgQVPBe0EwQTVBBEFKwVwBXMFRwU2BasFKQVMBVcFcwWIBasFwgXzBcUFmwXqBe0F7gXBBewF2gUkBv4FCQaGBq0GnQbqBkkHGwcVB/UGQgYlBgMGJwb9BRMGDQbJBccFoQXxBfkFFwZYBoUGPAeTB2cH3gaMBrMGwQZzBpAGUgZXBgYGIAZvBiEGsAWSBbIFuAVQBYEFuQWnBcMF6wUQBiwG1AX2BY4FpgWtBQYG5QZgByAHJwf2BmsGrgbuBkEGDAZEBi8GCQbYBc4FSQY/BhUGtwXaBY0FMgWcBakFqQXaBeoFBwbgBZ4FcwVzBXIFPAVhBegERwSCBKwEiQRQBDwEUQQaBBgEtQOUA48DygM5AyMD+gLrAgsDTwPQAuYCIwNeA30DrwPFA7ID7gLbArcCuQLkAjIDKQMGA8UCwQKfAmQCgAJPAjQCSAIBAvMB/QHFAQsC0AHmAdMB7gEjAjgCbAKNAj8CZCm7JpwktyLVIEMfrh2MHGUbgRmqGGYYMRgXGJIYchmhGUUZHxmXGeUaxxumHF4d6B7xH6Ag2CF9OCs3MzRJMWwubSutKNIlGSMUIGsdgxoyGMQV1RO3EfUPnA7fDo8O6A2HDeoNGQ6YDZYN4gz0C1kLFgspCyQLKAtOC6kL3QtTJzgl1CKoIIce8xznGpEZaBddFgAVERM2EQAQIA+XDYIM4wrnCfAIgQfUBo0F9gS5BIMEGQRJBAgFNAVCBfYEDwUKBYQF+AXABlEHGAfgBesEPQR4AwcDhgITAscBhwEkAc8AkwBsAE0AXgA0ACMAGAAFAAEAAgALABkAJgA0AE0AdACOAKYAyQDwAAkBGQEZAUMBUAFmAZwBxAHfAQkCEwJeAmICmQLMAvACLgNXA1cDtAPsA/gDPQRgBKwEqwTIBMAEvwSzBLcEvwSaBI4EhQSWBJIEfgRfBG4EYgRWBGMEXgRaBFgEcwQ0BCUEUQRPBEgEOwRDBG4ETwQ6BPwDVwRABGcElwS6BIsEmwSKBJUEqASUBIMEiASLBJgEmgSbBI8EXwRiBDgEHgT5A9IDvQN8A2EDjAOXA5sDnwOhA78DygP2A88DuAOlA4sDtQPnAxYEMwRZBKIETgVnBV0FvAVaBmEGgwY2BzcHawfmB1wIQAgmCE0IdwhXCBIJBgnzCQcK4wnVCrwKAgvDCt8K9ApBC0gLfgtPCz0LeQs5CzALFAvkCr4KBgv6CqkKgQqZCoYK3wrMCocKYApxCnEKMgoUChUK+QnnCccJjQlPCREJHwkyCR8JFQkkCTEJHQnjCLMIfAh+CF4IcAiaCJgIaQglCPUHsQdnB1sHJgcfB+QGvQaaBpUGZQZhBkgGPAYcBuwFwwWiBWsFUAUsBQUF9QTgBNQErASKBHQEnQSlBKQEywT8BBQFHQUgBUQFWQWzBcsFvgWvBZ0FlAWCBXQFkQV0BXEFXgVfBVoFPQU3BSQFCwXdBOYE5gRYLH0qDymRJmIkYSMtIrMh2iC+H6Aelh6dHhAf+h7RHnYfkR/PH90fAyEkIkgjnyS4JbUmuyfDKK0pbypRKRYovyZaJS0koyKtIZ8gVR/PHZ8cvhtUGvgYMRgIF6kV7xQCFNoS0RHTENEPJg9ODhsNPwxgC6AKjwn/CCoImwcvB4sGAAaIBQEFlgQwBNUDhwM5A+8CqQJqAjAC/wHMAZ0BgwF1AVQBJwECAdcAvAC8ALgAlQCGAHQAawB2AH0AZQBTAGoAiACJAL4A+QAEAXABdQHeAZsBEQIpAr0BRgKvAjUCWQI3AlkCwgK2AqsCCAM8A5MDsgN1A3cDjQNuA9YDqwOfA7EDowPaAykEgQRwBIUEjAQMBQ4FZQVrBdoFwAWpBWwFawVKBZMFKgZNBowG/Aa/Bv8G2gYWB3cGHwZbBqcFogXQBC4FQAVBBVYFiQUwBVsF6wTMBF4EPgRgBEwEdQT4BP0E/wQnBRAF9wTuBPIEuASFBG0EcgSXBMME6AT3BMoE9ASYBH4EHAToA10DhQMdMLguTS0yLMMpCyhbJ9QmRCXvJNYk0iOzI5IjbyKQIjoiXSLWInsj5iMwJNkkmSXbJjMoJSktKuIqkit7K/QpmCgeJxEmYSR6IwYiRCFEIBIf+B25HMoanxk0GKoWiRXQE9YSshF8EHMPZg7tDakMrgvfCskJ1gjqB0MHpAbSBWEFtgRuBAYEgANEA8wCZQIQAs0BngGDAZgBRwFJARAB/AC8ALcAsQB+AGYAdACBAGEAPAAdABYAGAAaABkADAARABMAJQA7AEMAaQCQALEAGAE2AXIBigFoAWsBowGoAcEBHQIaAjYCWgKJAgADSwOEA58DzAMBBOoDWwRqBFwEmASbBI0EXwRbBD0EXwRyBGMEYwQPBMwD0gO+A7ADlgOZA40DfgOJA54DrAMpBFMEMAQmBBkEDgTiA90D8QPMA7oD7QMdBDYERQRZBIYEsQTABMkEKwV9BYwF6QXfBcAFxwXQBcgF9QUqBg0G6wU9BgwGFQaLBrkGwwYhByoHCgcJBwYH6QbwBv4GQwdQBxwHDwcVBzsHJAc6B0MHTgdQB18HfwdyB6kHxAcBCPYH4wfNB98HzwfgB/AHxgeRB2oHWAc6Bx4H/ioaKeknxCZnJdckPCQZI+UiMSL8IbsiWyJOIr0iFyLMIeIhPyJWI4wjmSOjJEMlniXmJpIniSifKfUphShEJ80lXiS2IgsirSBBHy4e+Rw5HJUb2xn/GEwX/hZOFVEUbBNXEjMRXhBtDy4OPw2ZDM4LHguVCqwJKQmoCLwH8waeBsEGeAYOBsYFXgW7BKUEVwSZA3IDGgOvAnUCLQLmAa4BZAHzAL0ArQB4AGcAQQA5ACYACgAEAAIAAAACAAMABgAMABIAGAAgACkAMwBCAE4AaACYAMUADgH/AHQBdgGjAc8BKgIwAk0CfgI3AicCUwJ